{
  "$schema": "http://json-schema.org/draft-07/schema#",
  "$id": "https://gpfh-assets.s3.amazonaws.com/about.schema.json",
  "title": "About",
  "description": "GPFH about page content",
  "type": "object",
  "properties": {
    "intro": {
      "type": "object",
      "properties": {
        "text": {
          "type": "string"
        },
        "img": {
          "type": "object",
          "properties": {
            "title": {
              "type": "string"
            },
            "url": {
              "type": "string"
            },
            "alt": {
              "type": "string"
            }
          }
        }
      }
    },
    "commitment": {
      "type": "object",
      "properties": {
        "title": {
          "type": "object",
          "properties": {
            "upper": {
              "type": "string"
            },
            "lower": {
              "type": "string"
            }
          }
        },
        "text": {
          "type": "string"
        },
        "img": {
          "type": "object",
          "properties": {
            "title": {
              "type": "string"
            },
            "url": {
              "type": "string"
            },
            "alt": {
              "type": "string"
            }
          }
        }
      }
    },
    "nhba": {
      "type": "object",
      "properties": {
        "text": {
          "type": "string"
        }
      }
    },
    "ecoFriendly": {
      "type": "object",
      "properties": {
        "text": {
          "type": "string"
        },
        "img": {
          "type": "object",
          "properties": {
            "title": {
              "type": "string"
            },
            "url": {
              "type": "string"
            },
            "alt": {
              "type": "string"
            }
          }
        }
      }
    }
  },
  "required": [
    "intro",
    "commitment",
    "ecoFriendly"
  ]
}